{
  "schemaVersion": "1.0",
  "moduleId": "cbc_suite_v1",
  "packVersion": "0.1.0-proposal",
  "rfInputs": [
    {
      "runId": "rf_run_20260717_rf_cbc_001_pediatric_cds_establish",
      "bundleSha256": "sha256:9167e325a18fbcf0cad424f64c40585df9b513e8dd13d977f79ef4f98abd31ae",
      "claimLedgerSha256": "sha256:ace45e9e0956700e9355db4d42a43c5a83dcf88c889703617acff92327018f4f",
      "verificationExitCode": 0
    }
  ],
  "converter": {
    "name": "rf-bundle-to-kb-pack",
    "version": "0.1.0",
    "configSha256": "sha256:124d87fdbf81c33806532c0d1a7386ca1ae113c6dc69381b71d84a5d71f6d11b"
  },
  "testCorpusHash": "sha256:77724550bf925778aa0dbe7df7bb8b78cbdea9083a25e2928301e01815c66fad",
  "traceabilityHash": "sha256:dbff19d668a93cd3b2605a6ca8fda1ad624a75597e2d9c3642b32d25ba15c5c9"
}
